{
  "$schema": "../schemas/mystery-v2-visual-prefabs.schema.json",
  "schema_version": 1,
  "format": "mystery-v2-visual-prefabs",
  "status": "draft",
  "prefabs": [
    {
      "number": 1,
      "id": "durability-loss",
      "title": "PIERDE DURABILIDAD",
      "role": "property-state",
      "status": "draft",
      "description": "La barra baja en escalones cada vez más rápidos hasta que el objeto se rompe.",
      "relations": [
        "durability",
        "wear",
        "item_break"
      ],
      "supportedKinds": [
        "weapon",
        "tool",
        "item",
        "armor"
      ],
      "assets": [
        "mc-assets/item-assets/IRON_PICKAXE.png"
      ]
    },
    {
      "number": 2,
      "id": "stack-limit",
      "title": "LÍMITE DE STACK",
      "role": "property-state",
      "status": "draft",
      "description": "Slot de inventario que destaca la cantidad máxima.",
      "relations": [
        "stack_limit",
        "inventory"
      ],
      "supportedKinds": [
        "item",
        "food",
        "weapon",
        "tool",
        "block"
      ],
      "assets": [
        "mc-assets/item-assets/ENDER_PEARL.png"
      ]
    },
    {
      "number": 3,
      "id": "charge-level",
      "title": "SE PUEDE CARGAR",
      "role": "property-state",
      "status": "draft",
      "description": "Carga progresiva alrededor del objeto.",
      "relations": [
        "charge",
        "loaded_state"
      ],
      "supportedKinds": [
        "weapon",
        "item"
      ],
      "assets": [
        "mc-assets/item-assets/CROSSBOW.png"
      ]
    },
    {
      "number": 4,
      "id": "cooldown",
      "title": "TIENE COOLDOWN",
      "role": "property-state",
      "status": "draft",
      "description": "Reloj radial que bloquea y libera el uso.",
      "relations": [
        "cooldown",
        "reuse_delay"
      ],
      "supportedKinds": [
        "item",
        "weapon",
        "food"
      ],
      "assets": [
        "mc-assets/item-assets/ENDER_PEARL.png"
      ]
    },
    {
      "number": 5,
      "id": "enchantment-glint",
      "title": "PUEDE ENCANTARSE",
      "role": "property-state",
      "status": "draft",
      "description": "Brillo encantado recorre el objeto.",
      "relations": [
        "enchantable",
        "enchantment"
      ],
      "supportedKinds": [
        "weapon",
        "tool",
        "item",
        "armor"
      ],
      "assets": [
        "mc-assets/item-assets/DIAMOND_SWORD.png",
        "mc-assets/item-assets/ENCHANTED_BOOK.png"
      ]
    },
    {
      "number": 6,
      "id": "consumable-bites",
      "title": "RESTAURA HAMBRE",
      "role": "property-state",
      "status": "draft",
      "description": "El alimento pierde bocados mientras la barra de hambre se recupera.",
      "relations": [
        "consumable",
        "food",
        "nutrition",
        "saturation"
      ],
      "supportedKinds": [
        "food",
        "item"
      ],
      "assets": [
        "mc-assets/item-assets/APPLE.png",
        "mc-assets/item-assets/COOKED_BEEF.png"
      ]
    },
    {
      "number": 7,
      "id": "repair-restore",
      "title": "SE PUEDE REPARAR",
      "role": "property-state",
      "status": "draft",
      "description": "Un objeto desgastado pasa por el yunque y recupera durabilidad.",
      "relations": [
        "repairable",
        "repair",
        "durability_restore"
      ],
      "supportedKinds": [
        "weapon",
        "tool",
        "armor",
        "item"
      ],
      "assets": [
        "mc-assets/item-assets/IRON_PICKAXE.png",
        "mc-assets/item-assets/ANVIL.png"
      ]
    },
    {
      "number": 8,
      "id": "growth-stages",
      "title": "TIENE ETAPAS",
      "role": "property-state",
      "status": "draft",
      "description": "Secuencia visible de crecimiento.",
      "relations": [
        "growth",
        "age_state"
      ],
      "supportedKinds": [
        "plant",
        "block"
      ],
      "assets": [
        "mc-assets/item-assets/WHEAT_SEEDS.png",
        "mc-assets/item-assets/WHEAT.png"
      ]
    },
    {
      "number": 9,
      "id": "emits-light",
      "title": "EMITE LUZ",
      "role": "property-state",
      "status": "draft",
      "description": "Halo que aumenta para representar nivel de luz.",
      "relations": [
        "light",
        "luminance"
      ],
      "supportedKinds": [
        "block",
        "item"
      ],
      "assets": [
        "mc-assets/item-assets/TORCH.png"
      ]
    },
    {
      "number": 10,
      "id": "grants-status-effect",
      "title": "DA UN EFECTO",
      "role": "property-state",
      "status": "draft",
      "description": "El jugador usa el objeto y recibe un efecto visible configurable.",
      "relations": [
        "status_effect",
        "buff",
        "debuff",
        "use_effect"
      ],
      "supportedKinds": [
        "food",
        "potion",
        "item"
      ],
      "assets": [
        "mc-assets/item-assets/POTION.png",
        "mc-assets/item-assets/GOLDEN_APPLE.png"
      ]
    },
    {
      "number": 11,
      "id": "melee-strike",
      "title": "ATAQUE CUERPO A CUERPO",
      "role": "action-interaction",
      "status": "draft",
      "description": "Steve empuña el objeto y golpea una entidad cercana.",
      "relations": [
        "melee",
        "attack"
      ],
      "supportedKinds": [
        "weapon",
        "tool",
        "item"
      ],
      "assets": [
        "mc-assets/item-assets/DIAMOND_SWORD.png",
        "mc-assets/entity-assets/flat/ZOMBIE.png"
      ]
    },
    {
      "number": 12,
      "id": "projectile-throw",
      "title": "SE PUEDE LANZAR",
      "role": "action-interaction",
      "status": "draft",
      "description": "Steve lanza el objeto en arco hasta impactar una entidad.",
      "relations": [
        "projectile",
        "throw",
        "ranged"
      ],
      "supportedKinds": [
        "weapon",
        "item"
      ],
      "assets": [
        "mc-assets/item-assets/TRIDENT.png",
        "mc-assets/entity-assets/flat/ZOMBIE.png"
      ]
    },
    {
      "number": 13,
      "id": "mining-break",
      "title": "ROMPE BLOQUES",
      "role": "action-interaction",
      "status": "draft",
      "description": "Steve usa la herramienta y desprende fragmentos del bloque.",
      "relations": [
        "mining",
        "break_block",
        "tool"
      ],
      "supportedKinds": [
        "tool"
      ],
      "assets": [
        "mc-assets/item-assets/DIAMOND_PICKAXE.png",
        "mc-assets/item-assets/STONE.png"
      ]
    },
    {
      "number": 14,
      "id": "block-place",
      "title": "SE PUEDE COLOCAR",
      "role": "action-interaction",
      "status": "draft",
      "description": "Steve coloca el bloque en una posición válida del mundo.",
      "relations": [
        "placeable",
        "placement"
      ],
      "supportedKinds": [
        "block",
        "item"
      ],
      "assets": [
        "mc-assets/item-assets/STONE.png"
      ]
    },
    {
      "number": 15,
      "id": "consume-use",
      "title": "SE PUEDE COMER",
      "role": "action-interaction",
      "status": "draft",
      "description": "Steve acerca el alimento, da bocados y recupera hambre.",
      "relations": [
        "eat",
        "consume",
        "hunger"
      ],
      "supportedKinds": [
        "food"
      ],
      "assets": [
        "mc-assets/item-assets/COOKED_BEEF.png"
      ]
    },
    {
      "number": 16,
      "id": "equip-armor",
      "title": "SE PUEDE EQUIPAR",
      "role": "action-interaction",
      "status": "draft",
      "description": "La pieza se ajusta sobre el cuerpo de Steve y queda equipada.",
      "relations": [
        "equip",
        "armor_slot"
      ],
      "supportedKinds": [
        "item",
        "armor"
      ],
      "assets": [
        "mc-assets/item-assets/DIAMOND_CHESTPLATE.png"
      ]
    },
    {
      "number": 17,
      "id": "mob-interaction",
      "title": "INTERACTÚA CON MOBS",
      "role": "action-interaction",
      "status": "draft",
      "description": "Steve usa un objeto sobre un mob para alimentarlo, esquilarlo, montarlo o curarlo.",
      "relations": [
        "mob_interaction",
        "feed",
        "shear",
        "tame",
        "ride",
        "milk"
      ],
      "supportedKinds": [
        "tool",
        "item",
        "food"
      ],
      "assets": [
        "mc-assets/item-assets/SHEARS.png",
        "mc-assets/entity-assets/flat/SHEEP.png"
      ]
    },
    {
      "number": 18,
      "id": "special-movement",
      "title": "CAMBIA TU MOVIMIENTO",
      "role": "action-interaction",
      "status": "draft",
      "description": "Steve vuela, navega, monta o se impulsa usando el objeto.",
      "relations": [
        "movement",
        "flight",
        "ride",
        "boost",
        "travel"
      ],
      "supportedKinds": [
        "item",
        "weapon",
        "armor",
        "vehicle"
      ],
      "assets": [
        "mc-assets/item-assets/ELYTRA.png",
        "mc-assets/item-assets/FIREWORK_ROCKET.png"
      ]
    },
    {
      "number": 19,
      "id": "redstone-activate",
      "title": "ACTIVA REDSTONE",
      "role": "action-interaction",
      "status": "draft",
      "description": "Steve acciona el objeto y la señal recorre un circuito.",
      "relations": [
        "redstone",
        "activation",
        "power"
      ],
      "supportedKinds": [
        "block",
        "item"
      ],
      "assets": [
        "mc-assets/item-assets/LEVER.png",
        "mc-assets/item-assets/REDSTONE.png"
      ]
    },
    {
      "number": 20,
      "id": "block-transformation",
      "title": "TRANSFORMA BLOQUES",
      "role": "action-interaction",
      "status": "draft",
      "description": "Steve usa una herramienta y el bloque cambia de estado.",
      "relations": [
        "block_transform",
        "strip",